{
  "$schema": "./schema.v1.json",
  "schemaVersion": 1,
  "kind": "computer_use_capability",
  "id": "northstar.find-member",
  "version": "1.0.0",
  "name": "Find a Northstar member",
  "description": "Find a member relationship by its exact member number and return the displayed identity summary.",
  "provenance": {
    "discoveryScenario": "a1",
    "discoveryRunIds": [
      "2026-09-14T17-43-49-966Z-a1-2df21715",
      "2026-09-14T17-43-49-966Z-a1-312507b0",
      "2026-09-14T17-43-49-966Z-a1-36ff57f4"
    ],
    "compiledBy": "human_reviewed"
  },
  "surface": {
    "kind": "web_accessibility",
    "application": "northstar-corebank",
    "applicationVersion": "7.4",
    "allowedOrigins": [
      "https://target-app-gamma.vercel.app",
      "http://localhost:4173"
    ]
  },
  "risk": {
    "level": "read_only",
    "requiresConfirmation": false,
    "allowedActions": [
      "navigate",
      "find",
      "click",
      "type",
      "snapshot",
      "screenshot"
    ]
  },
  "inputs": {
    "memberNumber": {
      "type": "string",
      "description": "Exact member number shown in CoreBank, up to 16 letters, digits, or hyphens.",
      "minLength": 1,
      "maxLength": 16,
      "pattern": "^[A-Za-z0-9-]+$",
      "logPolicy": "last4"
    }
  },
  "outputs": {
    "memberNumber": {
      "type": "string",
      "description": "Member number confirmed on the relationship summary.",
      "extract": {
        "kind": "accessibility_table_row",
        "label": "Member #"
      },
      "logPolicy": "last4"
    },
    "displayedName": {
      "type": "string",
      "description": "Member name displayed by CoreBank.",
      "extract": {
        "kind": "accessibility_table_row",
        "label": "Name"
      },
      "logPolicy": "redact"
    },
    "memberStatus": {
      "type": "string",
      "description": "Relationship status displayed by CoreBank.",
      "extract": {
        "kind": "accessibility_table_row",
        "label": "Status"
      },
      "logPolicy": "plain"
    }
  },
  "steps": [
    {
      "id": "open_application",
      "action": "navigate",
      "path": "/",
      "expect": {
        "kind": "visible_text",
        "text": "Operations Menu"
      }
    },
    {
      "id": "open_member_lookup",
      "action": "click",
      "locator": {
        "kind": "accessibility",
        "role": "link",
        "name": "MEMBER LOOKUP",
        "exact": true,
        "rationale": "The persistent banner exposes a unique operator-facing link; its runtime ref is resolved fresh in every session and across frames."
      },
      "expect": {
        "kind": "visible_text",
        "text": "MBR-10 Member Inquiry"
      }
    },
    {
      "id": "enter_member_number",
      "action": "type",
      "locator": {
        "kind": "accessibility",
        "role": "textbox",
        "nearText": "Member Number",
        "exact": true,
        "rationale": "The legacy input has no programmatic label, so it is anchored to the stable visible field label immediately preceding the textbox."
      },
      "input": "memberNumber"
    },
    {
      "id": "submit_member_lookup",
      "action": "click",
      "locator": {
        "kind": "accessibility",
        "role": "button",
        "name": "F6 - Locate",
        "exact": true,
        "rationale": "The function-key caption is the unique, stable operator-facing name for the lookup action."
      }
    }
  ],
  "completion": {
    "checkpoint": {
      "kind": "visible_text",
      "text": "Member Relationship Summary"
    },
    "outcomes": [
      {
        "classification": "business_outcome",
        "code": "N04",
        "marker": "BUSINESS RESULT N04",
        "message": "No member relationship matched the supplied member number."
      },
      {
        "classification": "recoverable",
        "code": "T14",
        "marker": "RECOVERABLE HOST CONDITION T14",
        "message": "The relationship index timed out; retry the same inquiry once.",
        "maxAttempts": 1,
        "recovery": {
          "id": "retry_member_lookup",
          "action": "click",
          "locator": {
            "kind": "accessibility",
            "role": "link",
            "name": "F5 - Retry host request",
            "exact": true,
            "rationale": "The interstitial provides a dedicated retry link that preserves the requested member context."
          }
        }
      },
      {
        "classification": "failure",
        "code": "S17",
        "marker": "SECURITY S17",
        "failureKind": "permission_denied",
        "message": "The operator is not permitted to view this relationship."
      },
      {
        "classification": "human_required",
        "code": "E01",
        "marker": "SESSION E01",
        "message": "The session expired and a human operator must sign in again."
      },
      {
        "classification": "failure",
        "code": "X500",
        "marker": "HOST X500",
        "failureKind": "application_error",
        "message": "CoreBank returned an unrecoverable host failure."
      }
    ],
    "assertions": [
      {
        "kind": "output_equals_input",
        "output": "memberNumber",
        "input": "memberNumber"
      }
    ]
  }
}
